{
  "schema_version": 1,
  "id": "frustum-lateral-area-577",
  "title": "Боковая поверхность усечённого конуса 3",
  "topic": "Стереометрия",
  "level": "school",
  "minutes": 6,
  "tags": [
    "усечённый конус",
    "стереометрия"
  ],
  "statement": [
    "Радиусы оснований усечённого конуса равны $5$ и $3$, образующая — $4$. Найдите площадь боковой поверхности."
  ],
  "materials": [],
  "solution": {
    "steps": [
      "Площадь боковой поверхности равна $S_{бок}=\\pi(R+r)l$.",
      "Подставляем: $S_{бок}=\\pi(5+3)\\cdot 4=32\\pi$."
    ],
    "answer": "$32\\pi$."
  },
  "mistakes": [
    "Подставьте в формулу именно те размеры, которые указаны в условии, и проверьте единицы измерения."
  ],
  "theory": [
    {
      "title": "Площадь боковой поверхности усечённого конуса: $S_{бок}=\\pi(R+r)l$."
    }
  ],
  "source": "Авторская задача практикума; сборник Н. П. Антонова (1973) — библиографический ориентир, не источник условия."
}
