{"schema_version":1,"id":"triangle-exterior-angle-theorem-225","title":"Внешний угол через два внутренних","topic":"Геометрия","level":"school","minutes":5,"tags":["треугольник","внешний угол"],"statement":["Два внутренних угла треугольника равны $42^\\circ$ и $73^\\circ$. Найдите внешний угол при третьей вершине."],"materials":[],"solution":{"steps":["Внешний угол треугольника равен сумме двух внутренних углов, не смежных с ним.","Сложим данные углы."],"answer":"$115^\\circ$."},"mistakes":["Внешний угол не смежен с теми двумя внутренними углами, которые складываются."],"theory":[{"title":"Теорема о внешнем угле треугольника."}],"source":"Авторская задача практикума; библиографический ориентир — сборник Антонова (1973), не источник условия."}
