{"schema_version":1,"id":"mixture-ratio-251","title":"Смешивание растворов одинаковой концентрации","topic":"Арифметика","level":"school","minutes":6,"tags":["смеси","массовая доля"],"statement":["Смешали 2 кг 10%-го раствора и 3 кг 10%-го раствора одного вещества. Какова концентрация полученной смеси?"],"materials":[],"solution":{"steps":["Масса растворённого вещества равна $0{,}1\\cdot2+0{,}1\\cdot3=0{,}5$ кг.","Общая масса раствора 5 кг; доля вещества $0{,}5/5=0{,}1$."],"answer":"10%."},"mistakes":["При смешивании растворов одинаковой концентрации итоговая концентрация не меняется."],"theory":[{"title":"Массовая доля вещества в растворе."}],"source":"Авторская задача практикума; библиографический ориентир — сборник Антонова (1973), не источник условия."}
