{"schema_version":1,"id":"rational-equation-proportions-465","title":"Рациональное уравнение с двумя дробями","topic":"Алгебра","level":"school","minutes":6,"tags":["рациональные уравнения","ОДЗ"],"statement":["Решите $\\frac2x+\\frac3{x}=5$. "],"materials":[],"solution":{"steps":["ОДЗ: $x\\ne0$. Сложим дроби с одинаковым знаменателем: $5/x=5$.","Разделим на 5 и получим $1/x=1$."],"answer":"$x=1$."},"mistakes":["Не забывайте исключить нулевой знаменатель."],"theory":[{"title":"Решение рациональных уравнений."}],"source":"Авторская задача практикума; библиографический ориентир — сборник Антонова (1973), не источник условия."}
