{
  "schema_version": 1,
  "id": "triangle-exterior-angle",
  "title": "Внешний угол треугольника",
  "topic": "Геометрия",
  "level": "basic",
  "minutes": 6,
  "tags": ["треугольник", "углы", "внешний угол"],
  "statement": ["В треугольнике два внутренних угла, не смежных с данным внешним углом, равны $38^\\circ$ и $67^\\circ$. Найдите внешний угол и третий внутренний угол."],
  "materials": [],
  "solution": {
    "steps": [
      "Внешний угол треугольника равен сумме двух внутренних углов, не смежных с ним: $38^\\circ+67^\\circ=105^\\circ$.",
      "Смежный с ним внутренний угол дополняет внешний до $180^\\circ$.",
      "Следовательно, третий внутренний угол равен $180^\\circ-105^\\circ=75^\\circ$."
    ],
    "answer": "Внешний угол $105^\\circ$, третий внутренний угол $75^\\circ$."
  },
  "mistakes": ["Внешний угол равен сумме двух удалённых внутренних углов.", "Смежные внешний и внутренний углы в сумме составляют $180^\\circ$."],
  "theory": [{"title": "Сумма углов треугольника и свойство внешнего угла."}],
  "source": "Авторская задача практикума; библиографический ориентир: Н. П. Антонов, «Сборник задач по элементарной математике» (1973). Условие составлено самостоятельно и не является цитатой или переработкой задачи из сборника."
}
