{"schema_version":1,"id":"tangent-line-slope-479","title":"Угловой коэффициент касательной","topic":"Математический анализ","level":"school","minutes":5,"tags":["производная","касательная"],"statement":["Найдите угловой коэффициент касательной к $f(x)=x^2$ при $x=3$. "],"materials":[],"solution":{"steps":["Производная равна $f'(x)=2x$.","Вычислим $f'(3)$."],"answer":"6."},"mistakes":["Наклон касательной в точке равен значению производной в этой точке."],"theory":[{"title":"Геометрический смысл производной."}],"source":"Авторская задача практикума; библиографический ориентир — сборник Антонова (1973), не источник условия."}
