{"schema_version":1,"id":"factor-cubic-301","title":"Вынесение общего множителя из кубического выражения","topic":"Алгебра","level":"school","minutes":5,"tags":["многочлены","вынесение множителя"],"statement":["Разложите на множители $3x^3-12x$."],"materials":[],"solution":{"steps":["Вынесем общий множитель $3x$: $3x(x^2-4)$.","Разложим разность квадратов."],"answer":"$3x(x-2)(x+2)$."},"mistakes":["После вынесения множителя проверьте оставшийся многочлен на дальнейшую факторизацию."],"theory":[{"title":"Вынесение общего множителя и разность квадратов."}],"source":"Авторская задача практикума; библиографический ориентир: Н. П. Антонов, «Сборник задач по элементарной математике» (1973). Условие составлено самостоятельно."}
