{
  "schema_version": 1,
  "id": "square-pyramid-lateral-area-658",
  "title": "Боковая поверхность квадратной пирамиды 4",
  "topic": "Стереометрия",
  "level": "school",
  "minutes": 6,
  "tags": [
    "пирамида",
    "стереометрия"
  ],
  "statement": [
    "Сторона квадратного основания пирамиды равна $4$, апофема боковой грани — $6$. Найдите площадь боковой поверхности."
  ],
  "materials": [],
  "solution": {
    "steps": [
      "Боковая поверхность состоит из четырёх равных треугольников: $S_{бок}=\\frac12\\cdot 4a\\cdot l=2al$.",
      "Подставляем: $S_{бок}=2\\cdot 4\\cdot 6=48$."
    ],
    "answer": "$48$."
  },
  "mistakes": [
    "Подставьте в формулу именно те размеры, которые указаны в условии, и проверьте единицы измерения."
  ],
  "theory": [
    {
      "title": "Площадь боковой поверхности правильной пирамиды: половина произведения периметра основания на апофему."
    }
  ],
  "source": "Авторская задача практикума; сборник Н. П. Антонова (1973) — библиографический ориентир, не источник условия."
}
