{"schema_version":1,"id":"three-equation-symmetric-274","title":"Симметричная система трёх уравнений","topic":"Алгебра","level":"advanced","minutes":7,"tags":["системы уравнений","симметрия"],"statement":["Решите систему $x+y=5$, $y+z=7$, $x+z=6$. "],"materials":[],"solution":{"steps":["Сложим первое и третье уравнения и вычтем второе: $2x=5+6-7=4$, значит $x=2$.","Тогда $y=5-2=3$ и $z=6-2=4$."],"answer":"$(x,y,z)=(2,3,4)$."},"mistakes":["Комбинируйте уравнения так, чтобы коэффициент выбранной переменной остался ненулевым."],"theory":[{"title":"Линейные системы и линейные комбинации уравнений."}],"source":"Авторская задача практикума; библиографический ориентир — сборник Антонова (1973), не источник условия."}
