{"schema_version":1,"id":"absolute-value-linear-93","title":"Линейное уравнение с модулем","topic":"Алгебра","level":"school","minutes":7,"tags":["модуль","уравнения"],"statement":["Решите уравнение $|3x+1|=8$."],"materials":[],"solution":{"steps":["Рассмотрим два случая: $3x+1=8$ или $3x+1=-8$.","Из первого уравнения $x=7/3$, из второго $x=-3$."],"answer":"$x=\\frac73$ или $x=-3$."},"mistakes":["При $|A|=c$ для положительного $c$ нужно учесть оба знака."],"theory":[{"title":"Определение модуля и уравнения вида $|A|=c$."}],"source":"Авторская задача; сборник Н. П. Антонова (1973) — библиографический ориентир, не источник условия."}
