{"schema_version":1,"id":"prism-volume-256","title":"Объём прямой призмы","topic":"Геометрия","level":"school","minutes":5,"tags":["призма","объём"],"statement":["Площадь основания призмы равна 14 см$^2$, высота — 9 см. Найдите объём."],"materials":[],"solution":{"steps":["Объём призмы равен площади основания, умноженной на высоту.","Вычислим $14\\cdot9$."],"answer":"126 см$^3$."},"mistakes":["Используйте площадь именно основания и перпендикулярную высоту призмы."],"theory":[{"title":"Объём призмы."}],"source":"Авторская задача практикума; библиографический ориентир — сборник Антонова (1973), не источник условия."}
