{
  "schema_version": 1,
  "id": "cone-lateral-area-548",
  "title": "Боковая поверхность конуса 4",
  "topic": "Стереометрия",
  "level": "school",
  "minutes": 6,
  "tags": [
    "конус",
    "стереометрия"
  ],
  "statement": [
    "Радиус основания конуса равен $4$, образующая — $6$. Найдите площадь боковой поверхности."
  ],
  "materials": [],
  "solution": {
    "steps": [
      "Площадь боковой поверхности конуса равна $S_{бок}=\\pi rl$.",
      "Подставляем: $S_{бок}=\\pi\\cdot 4\\cdot 6=24\\pi$."
    ],
    "answer": "$24\\pi$."
  },
  "mistakes": [
    "Подставьте в формулу именно те размеры, которые указаны в условии, и проверьте единицы измерения."
  ],
  "theory": [
    {
      "title": "Площадь боковой поверхности конуса: $S_{бок}=\\pi rl$."
    }
  ],
  "source": "Авторская задача практикума; сборник Н. П. Антонова (1973) — библиографический ориентир, не источник условия."
}
