{"schema_version":1,"id":"probability-two-red-343","title":"Два красных жетона без возвращения","topic":"Теория вероятностей","level":"school","minutes":6,"tags":["вероятность","выбор без возвращения"],"statement":["В мешке 4 красных и 2 синих жетона. Наугад достают два подряд без возвращения. Найдите вероятность, что оба красные."],"materials":[],"solution":{"steps":["Вероятность красного первым равна $4/6$.","После этого остаются 3 красных из 5 жетонов, поэтому вероятность второго красного равна $3/5$.","Перемножим вероятности последовательных событий."],"answer":"$\\frac{2}{5}$."},"mistakes":["После первого извлечения изменяются и число красных жетонов, и общее количество."],"theory":[{"title":"Умножение условных вероятностей при выборе без возвращения."}],"source":"Авторская задача практикума; библиографический ориентир — сборник Антонова (1973), не источник условия."}
