{
  "schema_version": 1,
  "id": "tree-leaf-count-full-binary-722",
  "title": "Листья полного бинарного дерева",
  "topic": "Дискретная математика",
  "level": "advanced",
  "minutes": 6,
  "tags": ["деревья", "бинарное дерево", "структуры данных"],
  "statement": [
    "В конечном полном бинарном дереве каждая внутренняя вершина имеет ровно двух детей. Если внутренних вершин $7$, сколько в дереве листьев?"
  ],
  "materials": [],
  "solution": {
    "steps": [
      "Пусть внутренних вершин $I=7$, листьев $L$, а всего вершин $I+L$.",
      "Каждая внутренняя вершина задаёт ровно два ребра к детям, поэтому рёбер $2I$.",
      "Дерево с $I+L$ вершинами имеет $I+L-1$ рёбер. Следовательно, $2I=I+L-1$, откуда $L=I+1=8$."
    ],
    "answer": "$8$ листьев."
  },
  "mistakes": [
    "Равенство числа рёбер $2I$ использует условие, что у каждой внутренней вершины именно два ребёнка."
  ],
  "theory": [
    {
      "title": "В полном бинарном дереве с $I$ внутренними вершинами число листьев равно $I+1$."
    }
  ],
  "source": "Авторская учебная задача; не цитата и не переработка из сборника Антонова."
}
