{
  "schema_version": 1,
  "id": "cone-volume-535",
  "title": "Объём конуса 1",
  "topic": "Стереометрия",
  "level": "school",
  "minutes": 6,
  "tags": [
    "конус",
    "стереометрия"
  ],
  "statement": [
    "Радиус основания конуса равен $1$, высота — $3$. Найдите объём."
  ],
  "materials": [],
  "solution": {
    "steps": [
      "Объём конуса равен трети произведения площади основания на высоту: $V=\\frac{1}{3}\\pi r^2h$.",
      "Подставляем: $V=\\frac{1}{3}\\pi\\cdot 1^2\\cdot 3=1\\pi$."
    ],
    "answer": "$1\\pi$."
  },
  "mistakes": [
    "Подставьте в формулу именно те размеры, которые указаны в условии, и проверьте единицы измерения."
  ],
  "theory": [
    {
      "title": "Объём конуса: $V=\\frac{1}{3}\\pi r^2h$."
    }
  ],
  "source": "Авторская задача практикума; сборник Н. П. Антонова (1973) — библиографический ориентир, не источник условия."
}
