{
  "schema_version": 1,
  "id": "cone-total-area-557",
  "title": "Полная поверхность конуса 3",
  "topic": "Стереометрия",
  "level": "school",
  "minutes": 6,
  "tags": [
    "конус",
    "стереометрия"
  ],
  "statement": [
    "Радиус основания конуса равен $3$, образующая — $6$. Найдите площадь полной поверхности."
  ],
  "materials": [],
  "solution": {
    "steps": [
      "К полной поверхности прибавляем площадь основания: $S=\\pi r(l+r)$.",
      "Подставляем: $S=\\pi\\cdot 3(6+3)=27\\pi$."
    ],
    "answer": "$27\\pi$."
  },
  "mistakes": [
    "Подставьте в формулу именно те размеры, которые указаны в условии, и проверьте единицы измерения."
  ],
  "theory": [
    {
      "title": "Площадь полной поверхности конуса: $S=\\pi r(l+r)$."
    }
  ],
  "source": "Авторская задача практикума; сборник Н. П. Антонова (1973) — библиографический ориентир, не источник условия."
}
