{
  "schema_version": 1,
  "id": "minimum-quadratic-reciprocal-692",
  "title": "Минимум суммы квадрата и обратного квадрата",
  "topic": "Неравенства",
  "level": "advanced",
  "minutes": 8,
  "tags": ["минимум", "неравенство", "замена переменной"],
  "statement": [
    "Найдите наименьшее значение $x^2+\\frac{2}{x^2}$ при действительном $x\\ne0$ и укажите, при каких $x$ оно достигается."
  ],
  "materials": [],
  "solution": {
    "steps": [
      "Положим $t=x^2$. Тогда $t>0$, и требуется найти минимум $t+\\frac2t$.",
      "По неравенству между средним арифметическим и геометрическим $t+\\frac2t\\ge2\\sqrt{t\\cdot\\frac2t}=2\\sqrt2$.",
      "Равенство достигается при $t=\\frac2t$, то есть $t=\\sqrt2$. Следовательно, $x^2=\\sqrt2$ и $x=\\pm\\sqrt[4]2$."
    ],
    "answer": "Минимум равен $2\\sqrt2$ при $x=\\pm\\sqrt[4]2$."
  },
  "mistakes": [
    "После замены $t=x^2$ учитывайте ограничение $t>0$.",
    "Проверяйте условие равенства в применённом неравенстве, чтобы найти все точки минимума."
  ],
  "theory": [
    {
      "title": "Для положительных $u,v$ выполняется $u+v\\ge2\\sqrt{uv}$, причём равенство достигается при $u=v$."
    }
  ],
  "source": "Авторская учебная задача; не цитата и не переработка из сборника Антонова."
}
