{"schema_version":1,"id":"system-absolute-value-468","title":"Система с квадратом и модулем","topic":"Алгебра","level":"school","minutes":6,"tags":["системы уравнений","модуль"],"statement":["Решите систему $x+y=5$, $|x-y|=1$. "],"materials":[],"solution":{"steps":["Из модуля получаем два случая: $x-y=1$ или $x-y=-1$.","Решив каждую систему вместе с $x+y=5$, получим пары $(3,2)$ и $(2,3)$."],"answer":"$(3,2)$ или $(2,3)$."},"mistakes":["Уравнение с модулем раскладывается на два возможных знаковых случая."],"theory":[{"title":"Системы линейных уравнений и раскрытие модуля по случаям."}],"source":"Авторская задача практикума; библиографический ориентир — сборник Антонова (1973), не источник условия."}
