{
  "schema_version": 1,
  "id": "rhombus-diagonals",
  "title": "Диагонали и площадь ромба",
  "topic": "Геометрия",
  "level": "school",
  "minutes": 8,
  "tags": ["ромб", "площадь", "теорема Пифагора"],
  "statement": ["Диагонали ромба равны 12 см и 16 см. Найдите его площадь и периметр."],
  "materials": [],
  "solution": {
    "steps": [
      "Площадь ромба равна половине произведения диагоналей: $S=\\frac{12\\cdot16}{2}=96$ см$^2$.",
      "Диагонали ромба пересекаются под прямым углом и делятся пополам. Половины диагоналей равны 6 и 8 см.",
      "Сторона ромба равна $\\sqrt{6^2+8^2}=10$ см, поэтому периметр равен 40 см."
    ],
    "answer": "Площадь $96$ см$^2$, периметр $40$ см."
  },
  "mistakes": ["В формуле площади учитывается половина произведения диагоналей.", "Для нахождения стороны используйте половины диагоналей."],
  "theory": [{"title": "Свойства диагоналей ромба, его площадь и теорема Пифагора."}],
  "source": "Авторская задача практикума; библиографический ориентир: Н. П. Антонов, «Сборник задач по элементарной математике» (1973). Условие составлено самостоятельно и не является цитатой или переработкой задачи из сборника."
}
