{"schema_version":1,"id":"polynomial-collect-terms-302","title":"Приведение подобных членов многочлена","topic":"Алгебра","level":"basic","minutes":4,"tags":["многочлены","подобные слагаемые"],"statement":["Упростите $4x^2-3x+2x^2+5x-7$."],"materials":[],"solution":{"steps":["Сложим коэффициенты при $x^2$: $4+2=6$.","Сложим коэффициенты при $x$: $-3+5=2$; постоянное слагаемое остаётся $-7$."],"answer":"$6x^2+2x-7$."},"mistakes":["Складываются только слагаемые одинаковой степени."],"theory":[{"title":"Приведение подобных членов многочлена."}],"source":"Авторская задача практикума; библиографический ориентир: Н. П. Антонов, «Сборник задач по элементарной математике» (1973). Условие составлено самостоятельно."}
