{
  "schema_version": 1,
  "id": "function-composition",
  "title": "Значение композиции функций",
  "topic": "Функции",
  "level": "school",
  "minutes": 6,
  "tags": ["функции", "композиция"],
  "statement": ["Даны функции $f(x)=2x-1$ и $g(x)=x^2+2$. Найдите $(g\\circ f)(3)$ и $(f\\circ g)(3)$."],
  "materials": [],
  "solution": {
    "steps": [
      "$(g\\circ f)(3)=g(f(3))$. Сначала $f(3)=5$, затем $g(5)=5^2+2=27$.",
      "$(f\\circ g)(3)=f(g(3))$. Сначала $g(3)=11$, затем $f(11)=2\\cdot11-1=21$."
    ],
    "answer": "$(g\\circ f)(3)=27$, $(f\\circ g)(3)=21$."
  },
  "mistakes": [
    "В композиции $g\\circ f$ сначала применяется функция $f$, а затем $g$.",
    "Порядок функций важен: композиции в общем случае не равны."
  ],
  "theory": [{"title": "Композиция функций и порядок подстановки."}],
  "source": "Авторская задача для практикума; не цитата из сборника Антонова."
}
