{"schema_version":1,"id":"linear-transformation-vector-429","title":"Действие матрицы на координатный вектор","topic":"Линейная алгебра","level":"school","minutes":6,"tags":["матрицы","векторы","линейное преобразование"],"statement":["Вычислите $\\begin{pmatrix}2&1\\\\1&2\\end{pmatrix}\\begin{pmatrix}1\\\\-1\\end{pmatrix}$. "],"materials":[],"solution":{"steps":["Первая координата равна $2\\cdot1+1\\cdot(-1)=1$.","Вторая координата равна $1\\cdot1+2\\cdot(-1)=-1$."],"answer":"$\\begin{pmatrix}1\\\\-1\\end{pmatrix}$."},"mistakes":["Каждая строка матрицы даёт отдельную координату результата."],"theory":[{"title":"Линейные преобразования, заданные матрицей."}],"source":"Авторская задача практикума; библиографический ориентир — сборник Антонова (1973), не источник условия."}
