{"schema_version":1,"id":"relative-speed-opposite-253","title":"Скорость сближения при движении навстречу","topic":"Арифметика","level":"school","minutes":6,"tags":["движение","относительная скорость"],"statement":["Два велосипедиста одновременно выехали навстречу друг другу из пунктов на расстоянии 42 км. Их скорости равны 12 км/ч и 9 км/ч. Через сколько часов они встретятся?"],"materials":[],"solution":{"steps":["При движении навстречу скорость сближения равна $12+9=21$ км/ч.","Время равно расстоянию, делённому на скорость сближения: $42/21$."],"answer":"2 часа."},"mistakes":["При движении навстречу скорости складываются."],"theory":[{"title":"Относительная скорость и равномерное движение."}],"source":"Авторская задача практикума; библиографический ориентир — сборник Антонова (1973), не источник условия."}
