{"schema_version":1,"id":"derivative-product-x-exp-243","title":"Производная произведения двух функций","topic":"Математический анализ","level":"advanced","minutes":7,"tags":["производная","правило произведения","экспонента"],"statement":["Найдите производную $f(x)=x e^x$. "],"materials":[],"solution":{"steps":["Используем правило произведения: $(uv)'=u'v+uv'$.","Для $u=x$ имеем $u'=1$, а для $v=e^x$ имеем $v'=e^x$."],"answer":"$f'(x)=e^x+xe^x=e^x(x+1)$."},"mistakes":["Производная произведения не равна произведению производных."],"theory":[{"title":"Правило произведения и производная экспоненты."}],"source":"Авторская задача практикума; библиографический ориентир — сборник Антонова (1973), не источник условия."}
